{
  "schema": "auto-swsh-frame-replay",
  "schemaVersion": 1,
  "replayId": "replace-with-replay-id",
  "scenarioId": "replace-with-scenario-id",
  "sourceKind": "synthetic",
  "baselineFrameId": 1,
  "source": {
    "type": "images",
    "frames": [
      {
        "frameId": 1,
        "sourceTimestampNs": 0,
        "path": "frames/frame-000001.png",
        "sha256": "replace-with-lowercase-sha256"
      },
      {
        "frameId": 2,
        "sourceTimestampNs": 16666667,
        "path": "frames/frame-000002.png",
        "sha256": "replace-with-lowercase-sha256"
      },
      {
        "frameId": 3,
        "sourceTimestampNs": 33333334,
        "path": "frames/frame-000003.png",
        "sha256": "replace-with-lowercase-sha256"
      }
    ]
  },
  "actions": [
    { "purpose": "seed", "index": 0, "frameIds": [2, 3] }
  ]
}
